{
  "canonicalization": "chp-stable-v1",
  "created_at": "2026-07-12T19:28:24.366433Z",
  "kind": "adapter-provenance",
  "package": "chp-adapter-planning",
  "publisher": {
    "host_id": "chp-release",
    "host_identity": {
      "anchors": [
        {
          "countersignature": "-----BEGIN SSH SIGNATURE-----\nU1NIU0lHAAAAAQAAADMAAAALc3NoLWVkMjU1MTkAAAAg5qHZxtZ8HVlzspvd/WxFfXKRm6\ngyof2xXFalgUb/bHMAAAAPY2hwLWhvc3QtYW5jaG9yAAAAAAAAAAZzaGE1MTIAAABTAAAA\nC3NzaC1lZDI1NTE5AAAAQE5WEoiFMzOzfYAjeNVgWnjWh0BZkhX5ZU23jEgvZVO5/wk0bd\n/x9S7lds1MJ5ceUKgIcnLAejTfdVmYbpIJQQw=\n-----END SSH SIGNATURE-----\n",
          "did": "did:key:z6MkuyYxVQL4aRVpAKPbG4tc15FJ9E1ryZSSHjFyqsBBuxAn",
          "type": "did"
        }
      ],
      "host_id": "chp-release",
      "key_id": "d20d8b42b94c3375",
      "public_key": "3iXoZQbvRVRl2rCRDpb6BYwLETaTpjtvJuvfA9EN7bU=",
      "signature": "Hv7qQ/WHlzLZEOdXh9yWTw7ZHvRgw/bZ3e9pQ16y+KmOv5rryyfPAr/ntm9KLULa1iv42IoBxjyKxiy4og+6CQ==",
      "valid_from": "2026-07-12T19:28:24.366433Z",
      "valid_until": null
    },
    "public_key": "3iXoZQbvRVRl2rCRDpb6BYwLETaTpjtvJuvfA9EN7bU="
  },
  "signature": {
    "algorithm": "ed25519",
    "key_id": "d20d8b42b94c3375",
    "signature": "Rn/EulOCMe2hDLwLLCo7vJ4iYophMFLqGSQRhaVaHhmLZaPX9RZWM7DF1P2nMyXJpUXHGPdcEHUwkpMdXiWmBw=="
  },
  "version": "0.31.0",
  "wheel_sha256": "686f7cb450d2cf4561abfbbe51329d2fdfe42c2584c3182ef6686c2e0a9f47b5"
}
