{
  "canonicalization": "chp-stable-v1",
  "created_at": "2026-07-11T14:32:03.829822Z",
  "kind": "adapter-provenance",
  "package": "chp-host",
  "publisher": {
    "host_id": "chp-release",
    "host_identity": {
      "anchors": [
        {
          "countersignature": "-----BEGIN SSH SIGNATURE-----\nU1NIU0lHAAAAAQAAADMAAAALc3NoLWVkMjU1MTkAAAAg5qHZxtZ8HVlzspvd/WxFfXKRm6\ngyof2xXFalgUb/bHMAAAAPY2hwLWhvc3QtYW5jaG9yAAAAAAAAAAZzaGE1MTIAAABTAAAA\nC3NzaC1lZDI1NTE5AAAAQE5WEoiFMzOzfYAjeNVgWnjWh0BZkhX5ZU23jEgvZVO5/wk0bd\n/x9S7lds1MJ5ceUKgIcnLAejTfdVmYbpIJQQw=\n-----END SSH SIGNATURE-----\n",
          "did": "did:key:z6MkuyYxVQL4aRVpAKPbG4tc15FJ9E1ryZSSHjFyqsBBuxAn",
          "type": "did"
        }
      ],
      "host_id": "chp-release",
      "key_id": "d20d8b42b94c3375",
      "public_key": "3iXoZQbvRVRl2rCRDpb6BYwLETaTpjtvJuvfA9EN7bU=",
      "signature": "GLw/v+RmuSkDHnz2kuiBzifTXRMH8WI8jlPGcmzjuYwYiGSjRfUhnuEpjXCGNQMagAM+mmpkI0NfLCf1269PCw==",
      "valid_from": "2026-07-11T14:32:03.829822Z",
      "valid_until": null
    },
    "public_key": "3iXoZQbvRVRl2rCRDpb6BYwLETaTpjtvJuvfA9EN7bU="
  },
  "signature": {
    "algorithm": "ed25519",
    "key_id": "d20d8b42b94c3375",
    "signature": "clY3uVj22hjhZmUd3XiXwoeK94XtCP4jVyhe00iRm4PgzBDxhjsopV0dIgwoQduBRU/043IAZ7srRkXEytBCCA=="
  },
  "version": "0.16.0",
  "wheel_sha256": "c5af2a70e06f6e8851a2ca4d532453d51628e8c6276f0af6ad7d066b4f0fd175"
}
