{
  "canonicalization": "chp-stable-v1",
  "created_at": "2026-07-12T17:39:18.604556Z",
  "kind": "adapter-provenance",
  "package": "chp-adapter-synology",
  "publisher": {
    "host_id": "chp-release",
    "host_identity": {
      "anchors": [
        {
          "countersignature": "-----BEGIN SSH SIGNATURE-----\nU1NIU0lHAAAAAQAAADMAAAALc3NoLWVkMjU1MTkAAAAg5qHZxtZ8HVlzspvd/WxFfXKRm6\ngyof2xXFalgUb/bHMAAAAPY2hwLWhvc3QtYW5jaG9yAAAAAAAAAAZzaGE1MTIAAABTAAAA\nC3NzaC1lZDI1NTE5AAAAQE5WEoiFMzOzfYAjeNVgWnjWh0BZkhX5ZU23jEgvZVO5/wk0bd\n/x9S7lds1MJ5ceUKgIcnLAejTfdVmYbpIJQQw=\n-----END SSH SIGNATURE-----\n",
          "did": "did:key:z6MkuyYxVQL4aRVpAKPbG4tc15FJ9E1ryZSSHjFyqsBBuxAn",
          "type": "did"
        }
      ],
      "host_id": "chp-release",
      "key_id": "d20d8b42b94c3375",
      "public_key": "3iXoZQbvRVRl2rCRDpb6BYwLETaTpjtvJuvfA9EN7bU=",
      "signature": "KI3ECBtK+GnpqiQUpr49c4ZUq9ozj8tnYwg0XGUIZ4t4ettWa2h9zL3qk4k9kPRQ8Ks1OiKwVnnEeaUDefwKCg==",
      "valid_from": "2026-07-12T17:39:18.604556Z",
      "valid_until": null
    },
    "public_key": "3iXoZQbvRVRl2rCRDpb6BYwLETaTpjtvJuvfA9EN7bU="
  },
  "signature": {
    "algorithm": "ed25519",
    "key_id": "d20d8b42b94c3375",
    "signature": "RTQQ+HRKY9rCN6Rfsv8/0eO8cHlfgvFY6WNvOCr5zCnSD6/VKDJycOa+3WVSa96SWUr0Uf0nmJbTSXZGbRZvCw=="
  },
  "version": "0.30.0",
  "wheel_sha256": "711e558157d1f0746c13c489f4cf48f7073a60d7384c931f385b315cf83ed60c"
}
