{
  "canonicalization": "chp-stable-v1",
  "created_at": "2026-07-13T01:39:05.237612Z",
  "kind": "adapter-provenance",
  "package": "chp-adapter-messages",
  "publisher": {
    "host_id": "chp-release",
    "host_identity": {
      "anchors": [
        {
          "countersignature": "-----BEGIN SSH SIGNATURE-----\nU1NIU0lHAAAAAQAAADMAAAALc3NoLWVkMjU1MTkAAAAg5qHZxtZ8HVlzspvd/WxFfXKRm6\ngyof2xXFalgUb/bHMAAAAPY2hwLWhvc3QtYW5jaG9yAAAAAAAAAAZzaGE1MTIAAABTAAAA\nC3NzaC1lZDI1NTE5AAAAQE5WEoiFMzOzfYAjeNVgWnjWh0BZkhX5ZU23jEgvZVO5/wk0bd\n/x9S7lds1MJ5ceUKgIcnLAejTfdVmYbpIJQQw=\n-----END SSH SIGNATURE-----\n",
          "did": "did:key:z6MkuyYxVQL4aRVpAKPbG4tc15FJ9E1ryZSSHjFyqsBBuxAn",
          "type": "did"
        }
      ],
      "host_id": "chp-release",
      "key_id": "d20d8b42b94c3375",
      "public_key": "3iXoZQbvRVRl2rCRDpb6BYwLETaTpjtvJuvfA9EN7bU=",
      "signature": "gmgGO8JCloCPknohdnjMjsFgzgfSdubvK1JaUesKU/MsokSb/o2E50fBjnin9PArNtSIOb2wCzk6a83C47S0Bg==",
      "valid_from": "2026-07-13T01:39:05.237612Z",
      "valid_until": null
    },
    "public_key": "3iXoZQbvRVRl2rCRDpb6BYwLETaTpjtvJuvfA9EN7bU="
  },
  "signature": {
    "algorithm": "ed25519",
    "key_id": "d20d8b42b94c3375",
    "signature": "QqM+M7MKA/amYY6sKRdKJkbtKVBJhRC0o2k4OkSGYNQjXWMeDDUKAty3nEFs2A8Rphu0z86iyABGA5N84uMjBg=="
  },
  "version": "0.37.0",
  "wheel_sha256": "fd0d4815ad40c390a764103accfb3f941c07db02cd83553bd95b3b1ee6a8c692"
}
