{
  "canonicalization": "chp-stable-v1",
  "created_at": "2026-07-11T20:03:47.763722Z",
  "kind": "adapter-provenance",
  "package": "chp-adapter-synology",
  "publisher": {
    "host_id": "chp-release",
    "host_identity": {
      "anchors": [
        {
          "countersignature": "-----BEGIN SSH SIGNATURE-----\nU1NIU0lHAAAAAQAAADMAAAALc3NoLWVkMjU1MTkAAAAg5qHZxtZ8HVlzspvd/WxFfXKRm6\ngyof2xXFalgUb/bHMAAAAPY2hwLWhvc3QtYW5jaG9yAAAAAAAAAAZzaGE1MTIAAABTAAAA\nC3NzaC1lZDI1NTE5AAAAQE5WEoiFMzOzfYAjeNVgWnjWh0BZkhX5ZU23jEgvZVO5/wk0bd\n/x9S7lds1MJ5ceUKgIcnLAejTfdVmYbpIJQQw=\n-----END SSH SIGNATURE-----\n",
          "did": "did:key:z6MkuyYxVQL4aRVpAKPbG4tc15FJ9E1ryZSSHjFyqsBBuxAn",
          "type": "did"
        }
      ],
      "host_id": "chp-release",
      "key_id": "d20d8b42b94c3375",
      "public_key": "3iXoZQbvRVRl2rCRDpb6BYwLETaTpjtvJuvfA9EN7bU=",
      "signature": "pnzpk4rGkHa5CqzFNsfNVF7i7rn8VBdw+wxJ91mGwysTGqlPAR7ISSHSeEOVPr30Qq3geJUivsPn3JuCXlmmAA==",
      "valid_from": "2026-07-11T20:03:47.763722Z",
      "valid_until": null
    },
    "public_key": "3iXoZQbvRVRl2rCRDpb6BYwLETaTpjtvJuvfA9EN7bU="
  },
  "signature": {
    "algorithm": "ed25519",
    "key_id": "d20d8b42b94c3375",
    "signature": "X9SGgA4rzNU1WT6Oyai5x087mSOCGmZTNVYNRwjnXTJLY0PG9jJr3vCe9gKdYfQEWnGfVNfZJ+tZfhsReKMpDA=="
  },
  "version": "0.17.0",
  "wheel_sha256": "4e3961b2e9dfca510cd13d5dc0eb808347fb197bcfb3eb15c2d64e2ce980f196"
}
