{
  "canonicalization": "chp-stable-v1",
  "created_at": "2026-07-11T22:39:59.980481Z",
  "kind": "adapter-provenance",
  "package": "chp-adapter-release",
  "publisher": {
    "host_id": "chp-release",
    "host_identity": {
      "anchors": [
        {
          "countersignature": "-----BEGIN SSH SIGNATURE-----\nU1NIU0lHAAAAAQAAADMAAAALc3NoLWVkMjU1MTkAAAAg5qHZxtZ8HVlzspvd/WxFfXKRm6\ngyof2xXFalgUb/bHMAAAAPY2hwLWhvc3QtYW5jaG9yAAAAAAAAAAZzaGE1MTIAAABTAAAA\nC3NzaC1lZDI1NTE5AAAAQE5WEoiFMzOzfYAjeNVgWnjWh0BZkhX5ZU23jEgvZVO5/wk0bd\n/x9S7lds1MJ5ceUKgIcnLAejTfdVmYbpIJQQw=\n-----END SSH SIGNATURE-----\n",
          "did": "did:key:z6MkuyYxVQL4aRVpAKPbG4tc15FJ9E1ryZSSHjFyqsBBuxAn",
          "type": "did"
        }
      ],
      "host_id": "chp-release",
      "key_id": "d20d8b42b94c3375",
      "public_key": "3iXoZQbvRVRl2rCRDpb6BYwLETaTpjtvJuvfA9EN7bU=",
      "signature": "/NVNv4SIcpWNGLjiTaP9/azm+Nj9Iv0MGAaoWj5MpN4nnilV3QHNWmbkabC/fbMoSQ+gJWnIXMduIMKbw3TKCQ==",
      "valid_from": "2026-07-11T22:39:59.980481Z",
      "valid_until": null
    },
    "public_key": "3iXoZQbvRVRl2rCRDpb6BYwLETaTpjtvJuvfA9EN7bU="
  },
  "signature": {
    "algorithm": "ed25519",
    "key_id": "d20d8b42b94c3375",
    "signature": "OyqyXM2ww2Tmdc9Mjlul/6XQFPAQBEJWWNqGFKc4+WzWATC36wpzZZWasWH1BQWSLoizavszUajur2i6ffNyCw=="
  },
  "version": "0.19.0",
  "wheel_sha256": "2f152f906f29394ddad54fabdd21cef158217f79d41a5d7113ecefa033cb1df6"
}
