{
  "canonicalization": "chp-stable-v1",
  "created_at": "2026-07-12T19:28:24.354760Z",
  "kind": "adapter-provenance",
  "package": "chp-adapter-launchd",
  "publisher": {
    "host_id": "chp-release",
    "host_identity": {
      "anchors": [
        {
          "countersignature": "-----BEGIN SSH SIGNATURE-----\nU1NIU0lHAAAAAQAAADMAAAALc3NoLWVkMjU1MTkAAAAg5qHZxtZ8HVlzspvd/WxFfXKRm6\ngyof2xXFalgUb/bHMAAAAPY2hwLWhvc3QtYW5jaG9yAAAAAAAAAAZzaGE1MTIAAABTAAAA\nC3NzaC1lZDI1NTE5AAAAQE5WEoiFMzOzfYAjeNVgWnjWh0BZkhX5ZU23jEgvZVO5/wk0bd\n/x9S7lds1MJ5ceUKgIcnLAejTfdVmYbpIJQQw=\n-----END SSH SIGNATURE-----\n",
          "did": "did:key:z6MkuyYxVQL4aRVpAKPbG4tc15FJ9E1ryZSSHjFyqsBBuxAn",
          "type": "did"
        }
      ],
      "host_id": "chp-release",
      "key_id": "d20d8b42b94c3375",
      "public_key": "3iXoZQbvRVRl2rCRDpb6BYwLETaTpjtvJuvfA9EN7bU=",
      "signature": "0CREMtMBqdl/xaOSR/x1rsmBLuCMtmp2eMYkfPtglgrWBqU8pm2N96r7mK1a8duOYpftDNaajJ1vPo61oj+fAw==",
      "valid_from": "2026-07-12T19:28:24.354760Z",
      "valid_until": null
    },
    "public_key": "3iXoZQbvRVRl2rCRDpb6BYwLETaTpjtvJuvfA9EN7bU="
  },
  "signature": {
    "algorithm": "ed25519",
    "key_id": "d20d8b42b94c3375",
    "signature": "BKQeENFCTFP2Rgotv3Zij1DwiZnMQz336Sv/LHs4QAtuNMyVdsdz8ANn3v+0mSoc+HVuUTpLVjcHOd0N2DoqDQ=="
  },
  "version": "0.31.0",
  "wheel_sha256": "85f1249f547abb4a01e378c2fd23e8f5971be117013c0fffaace2667955af057"
}
