{
  "canonicalization": "chp-stable-v1",
  "created_at": "2026-07-15T15:50:09.011797Z",
  "kind": "adapter-provenance",
  "package": "chp-adapter-launchd",
  "publisher": {
    "host_id": "chp-release",
    "host_identity": {
      "anchors": [
        {
          "countersignature": "-----BEGIN SSH SIGNATURE-----\nU1NIU0lHAAAAAQAAADMAAAALc3NoLWVkMjU1MTkAAAAg5qHZxtZ8HVlzspvd/WxFfXKRm6\ngyof2xXFalgUb/bHMAAAAPY2hwLWhvc3QtYW5jaG9yAAAAAAAAAAZzaGE1MTIAAABTAAAA\nC3NzaC1lZDI1NTE5AAAAQE5WEoiFMzOzfYAjeNVgWnjWh0BZkhX5ZU23jEgvZVO5/wk0bd\n/x9S7lds1MJ5ceUKgIcnLAejTfdVmYbpIJQQw=\n-----END SSH SIGNATURE-----\n",
          "did": "did:key:z6MkuyYxVQL4aRVpAKPbG4tc15FJ9E1ryZSSHjFyqsBBuxAn",
          "type": "did"
        }
      ],
      "host_id": "chp-release",
      "key_id": "d20d8b42b94c3375",
      "public_key": "3iXoZQbvRVRl2rCRDpb6BYwLETaTpjtvJuvfA9EN7bU=",
      "signature": "O1ei1Q6i8jSBHq6qKwRRdLeycKWVUBpiSg5QIh77B1ncE16WbsEw64YJYu/V7vXwKTMv484V3nJp8PDw8MPBDQ==",
      "valid_from": "2026-07-15T15:50:09.011797Z",
      "valid_until": null
    },
    "public_key": "3iXoZQbvRVRl2rCRDpb6BYwLETaTpjtvJuvfA9EN7bU="
  },
  "signature": {
    "algorithm": "ed25519",
    "key_id": "d20d8b42b94c3375",
    "signature": "tHcaM5fN77x02qv9kEMrnDpjPwJwukdrVptpvg/7+F+x/rsgtvmawnTC/lkqKW02YWYnTqzLmnEvxRlDabNKAw=="
  },
  "version": "0.45.0",
  "wheel_sha256": "06b003475f7661bf1e055db7ccbee6d925585a624242b92d2472c0dca1389227"
}
