{
  "canonicalization": "chp-stable-v1",
  "created_at": "2026-07-15T18:34:47.185230Z",
  "kind": "adapter-provenance",
  "package": "chp-adapter-secrets",
  "publisher": {
    "host_id": "chp-release",
    "host_identity": {
      "anchors": [
        {
          "countersignature": "-----BEGIN SSH SIGNATURE-----\nU1NIU0lHAAAAAQAAADMAAAALc3NoLWVkMjU1MTkAAAAg5qHZxtZ8HVlzspvd/WxFfXKRm6\ngyof2xXFalgUb/bHMAAAAPY2hwLWhvc3QtYW5jaG9yAAAAAAAAAAZzaGE1MTIAAABTAAAA\nC3NzaC1lZDI1NTE5AAAAQE5WEoiFMzOzfYAjeNVgWnjWh0BZkhX5ZU23jEgvZVO5/wk0bd\n/x9S7lds1MJ5ceUKgIcnLAejTfdVmYbpIJQQw=\n-----END SSH SIGNATURE-----\n",
          "did": "did:key:z6MkuyYxVQL4aRVpAKPbG4tc15FJ9E1ryZSSHjFyqsBBuxAn",
          "type": "did"
        }
      ],
      "host_id": "chp-release",
      "key_id": "d20d8b42b94c3375",
      "public_key": "3iXoZQbvRVRl2rCRDpb6BYwLETaTpjtvJuvfA9EN7bU=",
      "signature": "+AuCxWAV2/TWq6u61rbpqCutqxJ5DOnjdCoBuIbpE81uz7TaLn4JZR6XBbK0fKxDwv1UQrTj7H17LyDSwVxmAg==",
      "valid_from": "2026-07-15T18:34:47.185230Z",
      "valid_until": null
    },
    "public_key": "3iXoZQbvRVRl2rCRDpb6BYwLETaTpjtvJuvfA9EN7bU="
  },
  "signature": {
    "algorithm": "ed25519",
    "key_id": "d20d8b42b94c3375",
    "signature": "HC09emKUyN7iqEApnJNHqXHp71NG+7piUVQQtgsQut01DO9tkJ/yjZN6BowKvfLZJpcJN1wIlH/t2sA3CgtsCw=="
  },
  "version": "0.48.0",
  "wheel_sha256": "8966a3865be351a7a9292ec8bd6937f0a2933e649e0fbeee318a6ee35d65167c"
}
