{
  "canonicalization": "chp-stable-v1",
  "created_at": "2026-07-14T13:37:52.988807Z",
  "kind": "adapter-provenance",
  "package": "chp-adapter-smolagents",
  "publisher": {
    "host_id": "chp-release",
    "host_identity": {
      "anchors": [
        {
          "countersignature": "-----BEGIN SSH SIGNATURE-----\nU1NIU0lHAAAAAQAAADMAAAALc3NoLWVkMjU1MTkAAAAg5qHZxtZ8HVlzspvd/WxFfXKRm6\ngyof2xXFalgUb/bHMAAAAPY2hwLWhvc3QtYW5jaG9yAAAAAAAAAAZzaGE1MTIAAABTAAAA\nC3NzaC1lZDI1NTE5AAAAQE5WEoiFMzOzfYAjeNVgWnjWh0BZkhX5ZU23jEgvZVO5/wk0bd\n/x9S7lds1MJ5ceUKgIcnLAejTfdVmYbpIJQQw=\n-----END SSH SIGNATURE-----\n",
          "did": "did:key:z6MkuyYxVQL4aRVpAKPbG4tc15FJ9E1ryZSSHjFyqsBBuxAn",
          "type": "did"
        }
      ],
      "host_id": "chp-release",
      "key_id": "d20d8b42b94c3375",
      "public_key": "3iXoZQbvRVRl2rCRDpb6BYwLETaTpjtvJuvfA9EN7bU=",
      "signature": "GA8GF+JYduewSYLk+qCPGxf7syOct3rr1U8of+6Xv3sNQpX6aOLB1w6VD/svE3Us0EqGTwPW9PtoEMbLe8I2Ag==",
      "valid_from": "2026-07-14T13:37:52.988807Z",
      "valid_until": null
    },
    "public_key": "3iXoZQbvRVRl2rCRDpb6BYwLETaTpjtvJuvfA9EN7bU="
  },
  "signature": {
    "algorithm": "ed25519",
    "key_id": "d20d8b42b94c3375",
    "signature": "EpLz20cRcG03Ll8wuie2NOiNtKHCf38eKAAPA6nJJr8/rfPDYbh8Mby4aP0C3l02r+d6bWGKwW3DnNJlSqYrBw=="
  },
  "version": "0.42.2",
  "wheel_sha256": "172090453df3803858873946b1a29262f8c008e35d454b5c938c73cf7a856b9b"
}
