{
  "canonicalization": "chp-stable-v1",
  "created_at": "2026-07-12T21:25:47.961904Z",
  "kind": "adapter-provenance",
  "package": "chp-adapter-jobs",
  "publisher": {
    "host_id": "chp-release",
    "host_identity": {
      "anchors": [
        {
          "countersignature": "-----BEGIN SSH SIGNATURE-----\nU1NIU0lHAAAAAQAAADMAAAALc3NoLWVkMjU1MTkAAAAg5qHZxtZ8HVlzspvd/WxFfXKRm6\ngyof2xXFalgUb/bHMAAAAPY2hwLWhvc3QtYW5jaG9yAAAAAAAAAAZzaGE1MTIAAABTAAAA\nC3NzaC1lZDI1NTE5AAAAQE5WEoiFMzOzfYAjeNVgWnjWh0BZkhX5ZU23jEgvZVO5/wk0bd\n/x9S7lds1MJ5ceUKgIcnLAejTfdVmYbpIJQQw=\n-----END SSH SIGNATURE-----\n",
          "did": "did:key:z6MkuyYxVQL4aRVpAKPbG4tc15FJ9E1ryZSSHjFyqsBBuxAn",
          "type": "did"
        }
      ],
      "host_id": "chp-release",
      "key_id": "d20d8b42b94c3375",
      "public_key": "3iXoZQbvRVRl2rCRDpb6BYwLETaTpjtvJuvfA9EN7bU=",
      "signature": "9yXcdo08F37DERTArHuYN8nXw0t6eQ8BT0bl8dglpbH5ihwkBiRpqW86LZEW3NMQ7y7C8WIRTaXXYHeiC+GjBw==",
      "valid_from": "2026-07-12T21:25:47.961904Z",
      "valid_until": null
    },
    "public_key": "3iXoZQbvRVRl2rCRDpb6BYwLETaTpjtvJuvfA9EN7bU="
  },
  "signature": {
    "algorithm": "ed25519",
    "key_id": "d20d8b42b94c3375",
    "signature": "cyv1cp4kcfs+7Fc3DjhL8KCRDNMWKkGboY1F5qvNgO2NYJrsK07zSTvWwfuc/5z9vkwSJlnSrMOZGCdWTOewDA=="
  },
  "version": "0.33.0",
  "wheel_sha256": "ee857b1432431bff05ea548f39cf69de3b6993f8fe838afd31018c5cb817a5b3"
}
