{
  "canonicalization": "chp-stable-v1",
  "created_at": "2026-07-11T22:39:59.970851Z",
  "kind": "adapter-provenance",
  "package": "chp-adapter-mcp",
  "publisher": {
    "host_id": "chp-release",
    "host_identity": {
      "anchors": [
        {
          "countersignature": "-----BEGIN SSH SIGNATURE-----\nU1NIU0lHAAAAAQAAADMAAAALc3NoLWVkMjU1MTkAAAAg5qHZxtZ8HVlzspvd/WxFfXKRm6\ngyof2xXFalgUb/bHMAAAAPY2hwLWhvc3QtYW5jaG9yAAAAAAAAAAZzaGE1MTIAAABTAAAA\nC3NzaC1lZDI1NTE5AAAAQE5WEoiFMzOzfYAjeNVgWnjWh0BZkhX5ZU23jEgvZVO5/wk0bd\n/x9S7lds1MJ5ceUKgIcnLAejTfdVmYbpIJQQw=\n-----END SSH SIGNATURE-----\n",
          "did": "did:key:z6MkuyYxVQL4aRVpAKPbG4tc15FJ9E1ryZSSHjFyqsBBuxAn",
          "type": "did"
        }
      ],
      "host_id": "chp-release",
      "key_id": "d20d8b42b94c3375",
      "public_key": "3iXoZQbvRVRl2rCRDpb6BYwLETaTpjtvJuvfA9EN7bU=",
      "signature": "LQOepNNk2gnMgEWjFgQrXQZyIJApuXhIJLP8anSySvETtkmdpA17AlnMeXcB0sR/JxQIbUtaaWBlj8V9q0kxAQ==",
      "valid_from": "2026-07-11T22:39:59.970851Z",
      "valid_until": null
    },
    "public_key": "3iXoZQbvRVRl2rCRDpb6BYwLETaTpjtvJuvfA9EN7bU="
  },
  "signature": {
    "algorithm": "ed25519",
    "key_id": "d20d8b42b94c3375",
    "signature": "M5NGnT03S8es+JD+HIkWh4wU3Fo2QcAxpCZmVA9VU7PRTXR3QYNx2/87S3oYqt+DA3X31766Om/yZO1bPwx0Cg=="
  },
  "version": "0.19.0",
  "wheel_sha256": "910cfcaa3e9e54e371721cfd3c1dede62c6f961313357f8ae6621245929715a1"
}
