{
  "canonicalization": "chp-stable-v1",
  "created_at": "2026-07-11T21:18:03.704616Z",
  "kind": "adapter-provenance",
  "package": "chp-adapter-synology",
  "publisher": {
    "host_id": "chp-release",
    "host_identity": {
      "anchors": [
        {
          "countersignature": "-----BEGIN SSH SIGNATURE-----\nU1NIU0lHAAAAAQAAADMAAAALc3NoLWVkMjU1MTkAAAAg5qHZxtZ8HVlzspvd/WxFfXKRm6\ngyof2xXFalgUb/bHMAAAAPY2hwLWhvc3QtYW5jaG9yAAAAAAAAAAZzaGE1MTIAAABTAAAA\nC3NzaC1lZDI1NTE5AAAAQE5WEoiFMzOzfYAjeNVgWnjWh0BZkhX5ZU23jEgvZVO5/wk0bd\n/x9S7lds1MJ5ceUKgIcnLAejTfdVmYbpIJQQw=\n-----END SSH SIGNATURE-----\n",
          "did": "did:key:z6MkuyYxVQL4aRVpAKPbG4tc15FJ9E1ryZSSHjFyqsBBuxAn",
          "type": "did"
        }
      ],
      "host_id": "chp-release",
      "key_id": "d20d8b42b94c3375",
      "public_key": "3iXoZQbvRVRl2rCRDpb6BYwLETaTpjtvJuvfA9EN7bU=",
      "signature": "HldjplhV0oFEQmWypz14gD5nqv61+dxIE+s+I13UUKNGbh56WPMtrnVjVPtwcYOvImMfrRJ5R57NYrImrLDWBQ==",
      "valid_from": "2026-07-11T21:18:03.704616Z",
      "valid_until": null
    },
    "public_key": "3iXoZQbvRVRl2rCRDpb6BYwLETaTpjtvJuvfA9EN7bU="
  },
  "signature": {
    "algorithm": "ed25519",
    "key_id": "d20d8b42b94c3375",
    "signature": "RaF0QQOMAHgQZf+TgY2VyVh5SWVyA8Yr4h20wSzbmFi3w9e+FSNlictOEl2VclKa2NZrInd7dQ05w2O5tqyDCw=="
  },
  "version": "0.18.0",
  "wheel_sha256": "d8e098fcb88d2a6f4b12b621dce553d69e8518d6ba7d0caadc9c45addfafc7ce"
}
