{
  "canonicalization": "chp-stable-v1",
  "created_at": "2026-07-12T21:25:47.961065Z",
  "kind": "adapter-provenance",
  "package": "chp-adapter-host",
  "publisher": {
    "host_id": "chp-release",
    "host_identity": {
      "anchors": [
        {
          "countersignature": "-----BEGIN SSH SIGNATURE-----\nU1NIU0lHAAAAAQAAADMAAAALc3NoLWVkMjU1MTkAAAAg5qHZxtZ8HVlzspvd/WxFfXKRm6\ngyof2xXFalgUb/bHMAAAAPY2hwLWhvc3QtYW5jaG9yAAAAAAAAAAZzaGE1MTIAAABTAAAA\nC3NzaC1lZDI1NTE5AAAAQE5WEoiFMzOzfYAjeNVgWnjWh0BZkhX5ZU23jEgvZVO5/wk0bd\n/x9S7lds1MJ5ceUKgIcnLAejTfdVmYbpIJQQw=\n-----END SSH SIGNATURE-----\n",
          "did": "did:key:z6MkuyYxVQL4aRVpAKPbG4tc15FJ9E1ryZSSHjFyqsBBuxAn",
          "type": "did"
        }
      ],
      "host_id": "chp-release",
      "key_id": "d20d8b42b94c3375",
      "public_key": "3iXoZQbvRVRl2rCRDpb6BYwLETaTpjtvJuvfA9EN7bU=",
      "signature": "ayL7mJ9GOXA8qjUd8qERhscDwWnH3+TSKoCatZuLeXQLAEsMjEU+fXOmz59LI/ILYWJV1UdJOyHMFUUBSxlABA==",
      "valid_from": "2026-07-12T21:25:47.961065Z",
      "valid_until": null
    },
    "public_key": "3iXoZQbvRVRl2rCRDpb6BYwLETaTpjtvJuvfA9EN7bU="
  },
  "signature": {
    "algorithm": "ed25519",
    "key_id": "d20d8b42b94c3375",
    "signature": "v6iTaABCCAKV5DYZ3RQufzE2NWc57QU0jk5VgRLsRSeyzfDHZFRyU6dSInxJC3ElFseVyDswbC9OJrjDTT/EBQ=="
  },
  "version": "0.33.0",
  "wheel_sha256": "6235671fa24d54d7b1e5ebf52acc30599815223c7400d056c7681e98a48eb9c7"
}
