{
  "canonicalization": "chp-stable-v1",
  "created_at": "2026-07-15T17:23:04.814185Z",
  "kind": "adapter-provenance",
  "package": "chp-adapter-tailscale",
  "publisher": {
    "host_id": "chp-release",
    "host_identity": {
      "anchors": [
        {
          "countersignature": "-----BEGIN SSH SIGNATURE-----\nU1NIU0lHAAAAAQAAADMAAAALc3NoLWVkMjU1MTkAAAAg5qHZxtZ8HVlzspvd/WxFfXKRm6\ngyof2xXFalgUb/bHMAAAAPY2hwLWhvc3QtYW5jaG9yAAAAAAAAAAZzaGE1MTIAAABTAAAA\nC3NzaC1lZDI1NTE5AAAAQE5WEoiFMzOzfYAjeNVgWnjWh0BZkhX5ZU23jEgvZVO5/wk0bd\n/x9S7lds1MJ5ceUKgIcnLAejTfdVmYbpIJQQw=\n-----END SSH SIGNATURE-----\n",
          "did": "did:key:z6MkuyYxVQL4aRVpAKPbG4tc15FJ9E1ryZSSHjFyqsBBuxAn",
          "type": "did"
        }
      ],
      "host_id": "chp-release",
      "key_id": "d20d8b42b94c3375",
      "public_key": "3iXoZQbvRVRl2rCRDpb6BYwLETaTpjtvJuvfA9EN7bU=",
      "signature": "akalfNufg47lMY5qkfPAWwk7Iur7EncbfHBHTDft9VU6heQvQtXnGvIJkPcSyXXKFG07NwfFqNF3hnY5r6mQCg==",
      "valid_from": "2026-07-15T17:23:04.814185Z",
      "valid_until": null
    },
    "public_key": "3iXoZQbvRVRl2rCRDpb6BYwLETaTpjtvJuvfA9EN7bU="
  },
  "signature": {
    "algorithm": "ed25519",
    "key_id": "d20d8b42b94c3375",
    "signature": "+WK/JC+oNcaNqJWpey0Ga5JHdyDa26GU74O5iY8DKds4fbFnbmMO2FaoPPhiETEzn0jUJerg9QLIDD9svNE/Cg=="
  },
  "version": "0.47.0",
  "wheel_sha256": "4f2f3f82c1a91d81c718bf880f7064bef67f7ca78e82f77dc68779e16b926fa6"
}
