{
  "canonicalization": "chp-stable-v1",
  "created_at": "2026-07-12T17:39:18.610639Z",
  "kind": "adapter-provenance",
  "package": "chp-adapter-mcp",
  "publisher": {
    "host_id": "chp-release",
    "host_identity": {
      "anchors": [
        {
          "countersignature": "-----BEGIN SSH SIGNATURE-----\nU1NIU0lHAAAAAQAAADMAAAALc3NoLWVkMjU1MTkAAAAg5qHZxtZ8HVlzspvd/WxFfXKRm6\ngyof2xXFalgUb/bHMAAAAPY2hwLWhvc3QtYW5jaG9yAAAAAAAAAAZzaGE1MTIAAABTAAAA\nC3NzaC1lZDI1NTE5AAAAQE5WEoiFMzOzfYAjeNVgWnjWh0BZkhX5ZU23jEgvZVO5/wk0bd\n/x9S7lds1MJ5ceUKgIcnLAejTfdVmYbpIJQQw=\n-----END SSH SIGNATURE-----\n",
          "did": "did:key:z6MkuyYxVQL4aRVpAKPbG4tc15FJ9E1ryZSSHjFyqsBBuxAn",
          "type": "did"
        }
      ],
      "host_id": "chp-release",
      "key_id": "d20d8b42b94c3375",
      "public_key": "3iXoZQbvRVRl2rCRDpb6BYwLETaTpjtvJuvfA9EN7bU=",
      "signature": "ITze4WEZuJkPGxiXPMLtnQSyJLgj9W6nlbpLcXxh4bFgpggk0p+20My0k+5YQ7gnMwvUZ0eXd259vWSqpnQTCQ==",
      "valid_from": "2026-07-12T17:39:18.610639Z",
      "valid_until": null
    },
    "public_key": "3iXoZQbvRVRl2rCRDpb6BYwLETaTpjtvJuvfA9EN7bU="
  },
  "signature": {
    "algorithm": "ed25519",
    "key_id": "d20d8b42b94c3375",
    "signature": "GmvgMt47R9/Awc0usWelxLWXUKxWvnreWLwRRR63HnksSR3t3MU/PrOEaWV5fTins8XRNfJX1lN9seoobPupDA=="
  },
  "version": "0.30.0",
  "wheel_sha256": "adee7db008939d41d0593458f2691d1adad7101e4a2fe43c643ca31fa94987f1"
}
