{
  "canonicalization": "chp-stable-v1",
  "created_at": "2026-07-12T01:06:17.908064Z",
  "kind": "adapter-provenance",
  "package": "chp-adapter-filesystem",
  "publisher": {
    "host_id": "chp-release",
    "host_identity": {
      "anchors": [
        {
          "countersignature": "-----BEGIN SSH SIGNATURE-----\nU1NIU0lHAAAAAQAAADMAAAALc3NoLWVkMjU1MTkAAAAg5qHZxtZ8HVlzspvd/WxFfXKRm6\ngyof2xXFalgUb/bHMAAAAPY2hwLWhvc3QtYW5jaG9yAAAAAAAAAAZzaGE1MTIAAABTAAAA\nC3NzaC1lZDI1NTE5AAAAQE5WEoiFMzOzfYAjeNVgWnjWh0BZkhX5ZU23jEgvZVO5/wk0bd\n/x9S7lds1MJ5ceUKgIcnLAejTfdVmYbpIJQQw=\n-----END SSH SIGNATURE-----\n",
          "did": "did:key:z6MkuyYxVQL4aRVpAKPbG4tc15FJ9E1ryZSSHjFyqsBBuxAn",
          "type": "did"
        }
      ],
      "host_id": "chp-release",
      "key_id": "d20d8b42b94c3375",
      "public_key": "3iXoZQbvRVRl2rCRDpb6BYwLETaTpjtvJuvfA9EN7bU=",
      "signature": "qXJ2+7Y36wPxkTsQkGAqwM73OLczTmnoFSj6BHG2A9kl69k+oF5OEvlswBT3rR7ddzSEHuww3WizND+fZCeRBg==",
      "valid_from": "2026-07-12T01:06:17.908064Z",
      "valid_until": null
    },
    "public_key": "3iXoZQbvRVRl2rCRDpb6BYwLETaTpjtvJuvfA9EN7bU="
  },
  "signature": {
    "algorithm": "ed25519",
    "key_id": "d20d8b42b94c3375",
    "signature": "25R07kbtxyqLO6jGBna5V589ke1AZSzIuM0A1ZJVUTd4PhkkzhNuiTZxPS65Mq7l8kvClAA85AsKACSYFwcrAg=="
  },
  "version": "0.21.0",
  "wheel_sha256": "fa5fcf073cfda6b7d067fbda89e66c7cb9df3124ba910f4cbfc3094aa1e16cbc"
}
