{
  "canonicalization": "chp-stable-v1",
  "created_at": "2026-07-12T22:21:56.500192Z",
  "kind": "adapter-provenance",
  "package": "chp-adapter-sglang",
  "publisher": {
    "host_id": "chp-release",
    "host_identity": {
      "anchors": [
        {
          "countersignature": "-----BEGIN SSH SIGNATURE-----\nU1NIU0lHAAAAAQAAADMAAAALc3NoLWVkMjU1MTkAAAAg5qHZxtZ8HVlzspvd/WxFfXKRm6\ngyof2xXFalgUb/bHMAAAAPY2hwLWhvc3QtYW5jaG9yAAAAAAAAAAZzaGE1MTIAAABTAAAA\nC3NzaC1lZDI1NTE5AAAAQE5WEoiFMzOzfYAjeNVgWnjWh0BZkhX5ZU23jEgvZVO5/wk0bd\n/x9S7lds1MJ5ceUKgIcnLAejTfdVmYbpIJQQw=\n-----END SSH SIGNATURE-----\n",
          "did": "did:key:z6MkuyYxVQL4aRVpAKPbG4tc15FJ9E1ryZSSHjFyqsBBuxAn",
          "type": "did"
        }
      ],
      "host_id": "chp-release",
      "key_id": "d20d8b42b94c3375",
      "public_key": "3iXoZQbvRVRl2rCRDpb6BYwLETaTpjtvJuvfA9EN7bU=",
      "signature": "OhHhxbaPTSOKX+Q6d3uaQTxrof3qXDxJPiBu3GSOtWucteOwEBuLlDdXkR8adGhBwzBTDQh0X+fiHBpDad5JBg==",
      "valid_from": "2026-07-12T22:21:56.500192Z",
      "valid_until": null
    },
    "public_key": "3iXoZQbvRVRl2rCRDpb6BYwLETaTpjtvJuvfA9EN7bU="
  },
  "signature": {
    "algorithm": "ed25519",
    "key_id": "d20d8b42b94c3375",
    "signature": "84XTQPNnAcscp7y9iVX5f33chfPzn+7AtIoYb67gvoMpIKwwGemYonhCvFw5d+WM58TXYW/BER7A2RJ8F8dlAg=="
  },
  "version": "0.34.0",
  "wheel_sha256": "48ce7095692e34bc29ed4b90f6dca334821a0100f1d69c892baa27f70a77850f"
}
