{
  "canonicalization": "chp-stable-v1",
  "created_at": "2026-07-14T15:20:21.305386Z",
  "kind": "adapter-provenance",
  "package": "chp-adapter-messages",
  "publisher": {
    "host_id": "chp-release",
    "host_identity": {
      "anchors": [
        {
          "countersignature": "-----BEGIN SSH SIGNATURE-----\nU1NIU0lHAAAAAQAAADMAAAALc3NoLWVkMjU1MTkAAAAg5qHZxtZ8HVlzspvd/WxFfXKRm6\ngyof2xXFalgUb/bHMAAAAPY2hwLWhvc3QtYW5jaG9yAAAAAAAAAAZzaGE1MTIAAABTAAAA\nC3NzaC1lZDI1NTE5AAAAQE5WEoiFMzOzfYAjeNVgWnjWh0BZkhX5ZU23jEgvZVO5/wk0bd\n/x9S7lds1MJ5ceUKgIcnLAejTfdVmYbpIJQQw=\n-----END SSH SIGNATURE-----\n",
          "did": "did:key:z6MkuyYxVQL4aRVpAKPbG4tc15FJ9E1ryZSSHjFyqsBBuxAn",
          "type": "did"
        }
      ],
      "host_id": "chp-release",
      "key_id": "d20d8b42b94c3375",
      "public_key": "3iXoZQbvRVRl2rCRDpb6BYwLETaTpjtvJuvfA9EN7bU=",
      "signature": "JMlv8d+Ij9Z5opndh/s7QMmQYNSWSNE5A5tkKhnAcI327txpbayPqV9+lrmQCtWCE3rA8HEcaUN9J8U6Fq/4CQ==",
      "valid_from": "2026-07-14T15:20:21.305386Z",
      "valid_until": null
    },
    "public_key": "3iXoZQbvRVRl2rCRDpb6BYwLETaTpjtvJuvfA9EN7bU="
  },
  "signature": {
    "algorithm": "ed25519",
    "key_id": "d20d8b42b94c3375",
    "signature": "eGLvXOxlNqWOu96Je2yduIZI+Xny4Dkk4+w4RrXtY7uG69JTV79SvwuiJPFcEOjRG9KC7wWAehhLlPD+WtnnDg=="
  },
  "version": "0.43.1",
  "wheel_sha256": "cbed842345eb92eb666df16d2cc119af9096abf82f2497654a9b7b8013519170"
}
