{
  "canonicalization": "chp-stable-v1",
  "created_at": "2026-07-13T01:39:05.246998Z",
  "kind": "adapter-provenance",
  "package": "chp-adapter-registry",
  "publisher": {
    "host_id": "chp-release",
    "host_identity": {
      "anchors": [
        {
          "countersignature": "-----BEGIN SSH SIGNATURE-----\nU1NIU0lHAAAAAQAAADMAAAALc3NoLWVkMjU1MTkAAAAg5qHZxtZ8HVlzspvd/WxFfXKRm6\ngyof2xXFalgUb/bHMAAAAPY2hwLWhvc3QtYW5jaG9yAAAAAAAAAAZzaGE1MTIAAABTAAAA\nC3NzaC1lZDI1NTE5AAAAQE5WEoiFMzOzfYAjeNVgWnjWh0BZkhX5ZU23jEgvZVO5/wk0bd\n/x9S7lds1MJ5ceUKgIcnLAejTfdVmYbpIJQQw=\n-----END SSH SIGNATURE-----\n",
          "did": "did:key:z6MkuyYxVQL4aRVpAKPbG4tc15FJ9E1ryZSSHjFyqsBBuxAn",
          "type": "did"
        }
      ],
      "host_id": "chp-release",
      "key_id": "d20d8b42b94c3375",
      "public_key": "3iXoZQbvRVRl2rCRDpb6BYwLETaTpjtvJuvfA9EN7bU=",
      "signature": "j75MmvNwYeDX+BmkxCn29rlvUcs9fi8bEbHXTt/gysOw0J30R4K2Rw+8IcS8+Mv6ZI+0a8/vV+alfQG1jBbrBA==",
      "valid_from": "2026-07-13T01:39:05.246998Z",
      "valid_until": null
    },
    "public_key": "3iXoZQbvRVRl2rCRDpb6BYwLETaTpjtvJuvfA9EN7bU="
  },
  "signature": {
    "algorithm": "ed25519",
    "key_id": "d20d8b42b94c3375",
    "signature": "A3SyZ1a68HxYhsmyaOwDzTC1YHP7uvTRsBz+GUDyMwq5r7DksR1YV2oAYxPi2pKG8YPexMuah6jTPxBthLKnAw=="
  },
  "version": "0.37.0",
  "wheel_sha256": "c34aac82f6404628a574ee33d0b224dc0c88d299ae6bba1de7c1b3d120ea47e3"
}
