{
  "canonicalization": "chp-stable-v1",
  "created_at": "2026-07-10T19:46:58.354360Z",
  "kind": "adapter-provenance",
  "package": "chp-adapter-messages",
  "publisher": {
    "host_id": "chp-release",
    "host_identity": {
      "anchors": [
        {
          "countersignature": "-----BEGIN SSH SIGNATURE-----\nU1NIU0lHAAAAAQAAADMAAAALc3NoLWVkMjU1MTkAAAAg5qHZxtZ8HVlzspvd/WxFfXKRm6\ngyof2xXFalgUb/bHMAAAAPY2hwLWhvc3QtYW5jaG9yAAAAAAAAAAZzaGE1MTIAAABTAAAA\nC3NzaC1lZDI1NTE5AAAAQE5WEoiFMzOzfYAjeNVgWnjWh0BZkhX5ZU23jEgvZVO5/wk0bd\n/x9S7lds1MJ5ceUKgIcnLAejTfdVmYbpIJQQw=\n-----END SSH SIGNATURE-----\n",
          "did": "did:key:z6MkuyYxVQL4aRVpAKPbG4tc15FJ9E1ryZSSHjFyqsBBuxAn",
          "type": "did"
        }
      ],
      "host_id": "chp-release",
      "key_id": "d20d8b42b94c3375",
      "public_key": "3iXoZQbvRVRl2rCRDpb6BYwLETaTpjtvJuvfA9EN7bU=",
      "signature": "DjkGzPy10ACjUEUjUuxFozLkHdMlNQWZ3qzeVMVsC+DF/Pihc74exMInqqnXMLbjpbarQZFPMX3aRpnmeTlvBA==",
      "valid_from": "2026-07-10T19:46:58.354360Z",
      "valid_until": null
    },
    "public_key": "3iXoZQbvRVRl2rCRDpb6BYwLETaTpjtvJuvfA9EN7bU="
  },
  "signature": {
    "algorithm": "ed25519",
    "key_id": "d20d8b42b94c3375",
    "signature": "n7WBMykIGSVGgUttATLKbO3r4VdH9XYgxehfHyjqmEEBk8a6gyUd7hAC9ij84tTyADwKo35wGOQN7bc9Q/6FCA=="
  },
  "version": "0.13.0",
  "wheel_sha256": "b9e3db1751035aa25b9036e62483051a1b302768ad2c1f9a25e23a31c814b204"
}
