{
  "canonicalization": "chp-stable-v1",
  "created_at": "2026-07-13T00:14:12.040840Z",
  "kind": "adapter-provenance",
  "package": "chp-adapter-conformance",
  "publisher": {
    "host_id": "chp-release",
    "host_identity": {
      "anchors": [
        {
          "countersignature": "-----BEGIN SSH SIGNATURE-----\nU1NIU0lHAAAAAQAAADMAAAALc3NoLWVkMjU1MTkAAAAg5qHZxtZ8HVlzspvd/WxFfXKRm6\ngyof2xXFalgUb/bHMAAAAPY2hwLWhvc3QtYW5jaG9yAAAAAAAAAAZzaGE1MTIAAABTAAAA\nC3NzaC1lZDI1NTE5AAAAQE5WEoiFMzOzfYAjeNVgWnjWh0BZkhX5ZU23jEgvZVO5/wk0bd\n/x9S7lds1MJ5ceUKgIcnLAejTfdVmYbpIJQQw=\n-----END SSH SIGNATURE-----\n",
          "did": "did:key:z6MkuyYxVQL4aRVpAKPbG4tc15FJ9E1ryZSSHjFyqsBBuxAn",
          "type": "did"
        }
      ],
      "host_id": "chp-release",
      "key_id": "d20d8b42b94c3375",
      "public_key": "3iXoZQbvRVRl2rCRDpb6BYwLETaTpjtvJuvfA9EN7bU=",
      "signature": "HSc7gVsh7IfoSv2B1PYkkGFwstQiVwFpt4jNzcwCJOnJHwoT4aERfSSsEKgiHWw+086Vxo96jo2qipDujjGTCA==",
      "valid_from": "2026-07-13T00:14:12.040840Z",
      "valid_until": null
    },
    "public_key": "3iXoZQbvRVRl2rCRDpb6BYwLETaTpjtvJuvfA9EN7bU="
  },
  "signature": {
    "algorithm": "ed25519",
    "key_id": "d20d8b42b94c3375",
    "signature": "BAX6ea8RGERHxSz1Lhu+UAIOd3xUKGrUSMlP0EH/P/T7W2ztgaIz0kxSXe8MVZiu4/AS7kgTM0adaiCP7RhNDw=="
  },
  "version": "0.36.0",
  "wheel_sha256": "01ddf782e81e468cd0717c9ae8ca88189d78a482cbd5db4325737090c67925c3"
}
