{
  "canonicalization": "chp-stable-v1",
  "created_at": "2026-07-12T07:39:01.845272Z",
  "kind": "adapter-provenance",
  "package": "chp-adapter-conformance",
  "publisher": {
    "host_id": "chp-release",
    "host_identity": {
      "anchors": [
        {
          "countersignature": "-----BEGIN SSH SIGNATURE-----\nU1NIU0lHAAAAAQAAADMAAAALc3NoLWVkMjU1MTkAAAAg5qHZxtZ8HVlzspvd/WxFfXKRm6\ngyof2xXFalgUb/bHMAAAAPY2hwLWhvc3QtYW5jaG9yAAAAAAAAAAZzaGE1MTIAAABTAAAA\nC3NzaC1lZDI1NTE5AAAAQE5WEoiFMzOzfYAjeNVgWnjWh0BZkhX5ZU23jEgvZVO5/wk0bd\n/x9S7lds1MJ5ceUKgIcnLAejTfdVmYbpIJQQw=\n-----END SSH SIGNATURE-----\n",
          "did": "did:key:z6MkuyYxVQL4aRVpAKPbG4tc15FJ9E1ryZSSHjFyqsBBuxAn",
          "type": "did"
        }
      ],
      "host_id": "chp-release",
      "key_id": "d20d8b42b94c3375",
      "public_key": "3iXoZQbvRVRl2rCRDpb6BYwLETaTpjtvJuvfA9EN7bU=",
      "signature": "diHKTYoseOIRaB0L0Y6e1jQP8kyxfHGPdEyt7c+42i11L+9TMfB2Z9Ysc5KHbPD0cxBrq6s/OpgfV4q+rkYKBg==",
      "valid_from": "2026-07-12T07:39:01.845272Z",
      "valid_until": null
    },
    "public_key": "3iXoZQbvRVRl2rCRDpb6BYwLETaTpjtvJuvfA9EN7bU="
  },
  "signature": {
    "algorithm": "ed25519",
    "key_id": "d20d8b42b94c3375",
    "signature": "DGYQMs1x4Ui7wBgpQQ7oPBjCSgWWvHo/hZzStZ82jXrBQ8hdv04mJ12QaprqKIhfQeYadDyXDs0qZpRHyDNKAg=="
  },
  "version": "0.26.0",
  "wheel_sha256": "87409595811867c74a1185e892bc41dc279fdfa37dd04aaa7fc48e6f2ebf3caa"
}
