{
  "canonicalization": "chp-stable-v1",
  "created_at": "2026-07-14T06:45:29.741121Z",
  "kind": "adapter-provenance",
  "package": "chp-adapter-http",
  "publisher": {
    "host_id": "chp-release",
    "host_identity": {
      "anchors": [
        {
          "countersignature": "-----BEGIN SSH SIGNATURE-----\nU1NIU0lHAAAAAQAAADMAAAALc3NoLWVkMjU1MTkAAAAg5qHZxtZ8HVlzspvd/WxFfXKRm6\ngyof2xXFalgUb/bHMAAAAPY2hwLWhvc3QtYW5jaG9yAAAAAAAAAAZzaGE1MTIAAABTAAAA\nC3NzaC1lZDI1NTE5AAAAQE5WEoiFMzOzfYAjeNVgWnjWh0BZkhX5ZU23jEgvZVO5/wk0bd\n/x9S7lds1MJ5ceUKgIcnLAejTfdVmYbpIJQQw=\n-----END SSH SIGNATURE-----\n",
          "did": "did:key:z6MkuyYxVQL4aRVpAKPbG4tc15FJ9E1ryZSSHjFyqsBBuxAn",
          "type": "did"
        }
      ],
      "host_id": "chp-release",
      "key_id": "d20d8b42b94c3375",
      "public_key": "3iXoZQbvRVRl2rCRDpb6BYwLETaTpjtvJuvfA9EN7bU=",
      "signature": "UG0cPmtBONRvvYWGZa2C3yXGoYuXCgEC/SAy+lkVWLteNQu5T5WGmKQerCV8oMOuQSznnXQOwQsokKjWInBOAA==",
      "valid_from": "2026-07-14T06:45:29.741121Z",
      "valid_until": null
    },
    "public_key": "3iXoZQbvRVRl2rCRDpb6BYwLETaTpjtvJuvfA9EN7bU="
  },
  "signature": {
    "algorithm": "ed25519",
    "key_id": "d20d8b42b94c3375",
    "signature": "WOjHJAlSBrN5Hga6lO3hWqn7nvwqq85JXssyhJB6Ugl28/fwkpkCuvB2VKyYIjWpA2xbwfTyTvmY1kFJu8PPBQ=="
  },
  "version": "0.42.0",
  "wheel_sha256": "c14affe6e99421a7359c766161a39e31278240e91edaba9ee08acd9359ad9aa8"
}
